{"architectDecision":{"decision":"APPROVE","responsePath":".codex/gpt-pro-architect/responses/response-3rr.md","responseSha256":"sha256:19d1998f6207ba0f67095be9ed21ff649b35c6523aedb165715694c1115d6e74"},"attestation":{"algorithm":"Ed25519","keyId":"protocol.author.semantic-remediation-closure-2026-07-31.ed25519","signature":"-z6TW0pyYYRdQ7FCKqBAlwn-pcpAt3XP4GL1ZKZbw1vo_bAaCHswCUMyOLGGF_6BK6xS-9FJ3CM0czLxqNF-Aw"},"claimBoundary":{"attributionPerformanceClaim":false,"oldArtifactsRemainQuarantined":true,"researchEvidenceAuthorized":false,"selfEvolutionClaim":false,"semanticDevelopmentFixtureCorrectionClosed":true},"closedAt":"2026-07-31T05:08:59.516Z","closureId":"governance-remediation-closure.hfb-structural-oracle.2026-07-31","closureSourceCommit":"dcb29b29c570141bf2a8a5d7fb95864238369671","deviationId":"governance-deviation.hfb-structural-oracle.2026-07-31","deviationRecordHash":"sha256:c750a9bb2e00c2e5d15d73fab039d950c3df0e910274c006647b2ae9cc798e00","governanceDomainId":"self-evolving-harness.local-governance","publicPrincipal":{"identity":{"identityDigest":"sha256:bb0411cf91a5acbf7cef89f41224dc1c8b3f06e40dd2918e3bd234369cf56e43","implementationDigest":"sha256:b46c778053622acaecb31bf746874c71d547c1ad8b65af3fcb431c229ff9952c","instanceId":"protocol.author.semantic-remediation-closure-2026-07-31.instance","principalId":"protocol.author.semantic-remediation-closure-2026-07-31","role":"protocol_author"},"keyId":"protocol.author.semantic-remediation-closure-2026-07-31.ed25519","publicKeyPem":"-----BEGIN PUBLIC KEY-----\nMCowBQYDK2VwAyEAt00YSZ8rgDgd5LJGIOq4BfUt04sng6PA4D6qsILXLkc=\n-----END PUBLIC KEY-----\n"},"recordHash":"sha256:b7ef8d04c20c2c2904780b1cca4c758961a1e59b997e9e63d8fa879f5dde6a7a","recordType":"governance_remediation_closure","recordedBy":{"identityDigest":"sha256:bb0411cf91a5acbf7cef89f41224dc1c8b3f06e40dd2918e3bd234369cf56e43","implementationDigest":"sha256:b46c778053622acaecb31bf746874c71d547c1ad8b65af3fcb431c229ff9952c","instanceId":"protocol.author.semantic-remediation-closure-2026-07-31.instance","principalId":"protocol.author.semantic-remediation-closure-2026-07-31","role":"protocol_author"},"remediation":{"closureStatus":"closed_by_append_only_record","completedActions":["Preserved and mechanically quarantined all structural-oracle artifacts from research and adaptive use.","Renamed the original suite as structural and label-oracle plumbing.","Separated label-free runtime execution inputs from the benchmark-author oracle domain.","Executed all eight mutable component types through standalone runtime decision points.","Added an observable-only verifier and label-blind allowlist adapter with adversarial leakage tests.","Generated distinct semantic and label-blind commitments and obtained Architect approval."],"originalRecordWasModified":false,"originalStatusObserved":"in_progress","outstandingActions":[]},"replacementEvidence":{"evidenceFileSha256":"sha256:3083ce265e91292582dfbff6320ab8a1f536e9afc50280e18230dcfe434cb876","evidencePath":"architect/evidence/harness-fault-bench-semantic/evidence.json","labelBlindCorpusCommitment":"sha256:49f7dcbfaabdc122294b41f30d56f15d5eca6088d7941f07483968bdd58e1a01","semanticEvidenceSourceCommit":"829dd1943954ba64e6e0c08bae35710b3db348e4","semanticSuiteCommitment":"sha256:61c5f01ecb135436df55a76d169a26dac48379d18f31eb8e7d78e04a4e9c40be"},"schemaVersion":1}
